{
  "application_version": "0.1.0",
  "base_image_reference": "python:3.11.17-slim-trixie@sha256:e88e9763f943ec1834f992a4b51e0f24500486803e8bc534e5767af9ea65f6ce AS builder",
  "build_command_policy": "docker buildx build --load --platform linux/amd64 with OCI source labels",
  "builder": {
    "docker_buildx": "github.com/docker/buildx v0.27.0-desktop.1 0ea7d3a2239bb57d1c598c691c5d00101ca936b7"
  },
  "built_image_reference": "genomic-research-access-api:git-7bc2106054f197fdd432ce11412aede926764812",
  "container_scan_reference": "outputs/security/supply-chain/container-scan-summary.json",
  "container_scan_sha256": "5422b3d0bd3e22d6c6a9880e67db27e80e480878af3c78757011cffc15125cc2",
  "controlled_timestamp": "2026-10-12T11:21:32Z",
  "dependency_definition_sha256": "a7d4b5321d5c7251804e9ab86458633553c4ccd752ccc03811dd933362cc11ba",
  "dependency_inputs": [
    "pyproject.toml"
  ],
  "dirty_worktree": true,
  "dockerfile_sha256": "5a260d10297f75a3b6676c2175c6a1245595ce1f3ddcebad40b93b60f21fccca",
  "dockerignore_sha256": "20d754a54d1890b43c4a220e921750e9ff5bfced834f2c397d0b4e1e83c5c55d",
  "image_digest": "sha256:4cf7c5e4472e227388bb9fed5b87781bc1b8d0833dc699edce96f3116bee28ec",
  "image_id": "sha256:4cf7c5e4472e227388bb9fed5b87781bc1b8d0833dc699edce96f3116bee28ec",
  "publication_eligibility_reference": "outputs/security/supply-chain/publication-eligibility.json",
  "publication_eligibility_status": "blocked",
  "release_decision": "conditional_pass",
  "release_decision_id": "REL-d65797fa59025938",
  "release_decision_reference": "outputs/security/release/release-gate-decision.json",
  "release_decision_sha256": "7e90ad9ac25755a6ad0bf13964dfa1bf5853bd7bd201e9c45456823b9cf412ee",
  "repository_name": "devsecops-application-security-pipeline",
  "sbom_reference": "outputs/security/supply-chain/container-sbom.cdx.json",
  "sbom_sha256": "e94b93e4a7bf40bb76366518361372c01de6fa0520d3c8a79dbb6625bb47ea8f",
  "schema_version": "1.0",
  "source_commit": "7bc2106054f197fdd432ce11412aede926764812",
  "source_repository": "https://github.com/Ibraheemolasupogit/devsecops-application-security-pipeline",
  "target_platform": "linux/amd64"
}
